{
  "schema_version": "2.0",
  "collection": {
    "total_puzzles": 799,
    "by_puzzle_level": {
      "elementary": 202,
      "novice": 184,
      "intermediate": 200,
      "beginner": 13,
      "advanced": 200
    },
    "by_tag": {
      "vital-point": 110,
      "net": 301,
      "ko": 139,
      "life-and-death": 45,
      "connection": 39,
      "liberty-shortage": 65,
      "escape": 27,
      "sacrifice": 14,
      "tesuji": 77,
      "eye-shape": 29,
      "throw-in": 33,
      "capture-race": 15,
      "nakade": 33,
      "ladder": 61,
      "seki": 15,
      "under-the-stones": 36,
      "dead-shapes": 22,
      "snapback": 39,
      "connect-and-die": 13,
      "clamp": 2,
      "cutting": 2,
      "double-atari": 1
    },
    "by_puzzle_quality": {
      "1": 0,
      "2": 26,
      "3": 773,
      "4": 0,
      "5": 0
    }
  },
  "stages": {
    "ingest": {
      "attempted": 0,
      "passed": 0,
      "failed": 0
    },
    "analyze": {
      "enriched": 0,
      "skipped": 0
    },
    "publish": {
      "new": 799,
      "failed": 0
    }
  },
  "metrics": {
    "daily_publish_throughput": 0,
    "error_rate_ingest": 0.0,
    "error_rate_publish": 0.0
  },
  "audit": {
    "total_rollbacks": 0,
    "last_rollback_date": null
  },
  "last_updated": "2026-05-08T17:29:24.053063Z",
  "last_run_id": "20260508-a6410b97"
}